{
  "$schema": "https://json-schema.org/draft/2020-12/schema",
  "$id": "call_record.schema.json",
  "title": "call_record",
  "description": "The dashboard's per-call unit in out/calls.json: the call_log plus its outcome, scorecard, cost, and failures. The ONLY shape the dashboard consumes.",
  "type": "object",
  "required": [
    "call_id",
    "source",
    "language",
    "stress_profile",
    "workflow_type",
    "turns"
  ],
  "properties": {
    "call_id": {
      "type": "string"
    },
    "source": {
      "enum": [
        "spokenwoz",
        "ami",
        "hero",
        "bolna"
      ]
    },
    "language": {
      "type": "string"
    },
    "stress_profile": {
      "enum": [
        "clean",
        "pause_heavy",
        "interruption",
        "ambiguous",
        "kb_gap"
      ]
    },
    "workflow_type": {
      "type": "string"
    },
    "turns": {
      "type": "array",
      "minItems": 1,
      "items": {
        "type": "object",
        "required": [
          "turn_id",
          "speaker",
          "text",
          "start_ms"
        ],
        "properties": {
          "turn_id": {
            "type": "string"
          },
          "speaker": {
            "enum": [
              "user",
              "agent"
            ]
          },
          "text": {
            "type": "string"
          },
          "start_ms": {
            "type": "integer",
            "minimum": 0
          },
          "end_ms": {
            "type": [
              "integer",
              "null"
            ]
          }
        }
      }
    },
    "audio_path": {
      "type": [
        "string",
        "null"
      ]
    },
    "metadata": {
      "type": "object"
    },
    "outcome": {
      "type": [
        "object",
        "null"
      ]
    },
    "scorecard": {
      "type": [
        "object",
        "null"
      ]
    },
    "cost": {
      "type": [
        "object",
        "null"
      ]
    },
    "failures": {
      "type": "array",
      "items": {
        "type": "object"
      }
    },
    "signals": {
      "type": [
        "object",
        "null"
      ]
    }
  }
}
