{
  "call_id": "swz_MUL0280",
  "source": "spokenwoz",
  "language": "en",
  "stress_profile": "clean",
  "workflow_type": "profile+restaurant+train",
  "turns": [
    {
      "turn_id": "t1",
      "speaker": "user",
      "text": "hi , this is eric speaking .",
      "start_ms": 880,
      "end_ms": 3320
    },
    {
      "turn_id": "t2",
      "speaker": "agent",
      "text": "hi , eric . how are you doing it .",
      "start_ms": 3390,
      "end_ms": 5170
    },
    {
      "turn_id": "t3",
      "speaker": "user",
      "text": "i'm great things in yourself .",
      "start_ms": 5290,
      "end_ms": 7110
    },
    {
      "turn_id": "t4",
      "speaker": "agent",
      "text": "i'm great . thank you .",
      "start_ms": 7070,
      "end_ms": 8670
    },
    {
      "turn_id": "t5",
      "speaker": "user",
      "text": "alright , i am planning a trip to cambridge and i was wondering if you can assist some information , please .",
      "start_ms": 9150,
      "end_ms": 15010
    },
    {
      "turn_id": "t6",
      "speaker": "agent",
      "text": "i'll be happy to assist you .",
      "start_ms": 15240,
      "end_ms": 17120
    },
    {
      "turn_id": "t7",
      "speaker": "user",
      "text": "okay , i'm looking for a particular restaurant that is called the curry print .",
      "start_ms": 17320,
      "end_ms": 21990
    },
    {
      "turn_id": "t8",
      "speaker": "agent",
      "text": "okay , we do have the curry prince in our database .",
      "start_ms": 22480,
      "end_ms": 26030
    },
    {
      "turn_id": "t9",
      "speaker": "user",
      "text": "okay . um alright , so if i wanted to book a table with that restaurant , would i be able to do it through you .",
      "start_ms": 26290,
      "end_ms": 33120
    },
    {
      "turn_id": "t10",
      "speaker": "agent",
      "text": "yes , i can certainly make a booking for you .",
      "start_ms": 33300,
      "end_ms": 36070
    },
    {
      "turn_id": "t11",
      "speaker": "user",
      "text": "okay . could you please book it table for four people on thursday at kota past one in that .",
      "start_ms": 36010,
      "end_ms": 43800
    },
    {
      "turn_id": "t12",
      "speaker": "agent",
      "text": "okay , yes , i can do that , ma'am . please have your phone .",
      "start_ms": 44240,
      "end_ms": 48200
    },
    {
      "turn_id": "t13",
      "speaker": "user",
      "text": "certainly my full name is eric wilkinson .",
      "start_ms": 49400,
      "end_ms": 52830
    },
    {
      "turn_id": "t14",
      "speaker": "agent",
      "text": "thank you , eric . may you please spell that for me .",
      "start_ms": 53260,
      "end_ms": 56030
    },
    {
      "turn_id": "t15",
      "speaker": "user",
      "text": "sure , eric is potters er ic and then my last name moccasin inspired w 4 whiskey iphone india alpha lima k for kilo e 4 eco alpha roja , asus sierra offer , oscar info november .",
      "start_ms": 56180,
      "end_ms": 73940
    },
    {
      "turn_id": "t16",
      "speaker": "agent",
      "text": "thank you very much for that . eric booking for four has been made . and would you like to receive the order via email .",
      "start_ms": 74510,
      "end_ms": 82330
    },
    {
      "turn_id": "t17",
      "speaker": "user",
      "text": "no , thank you . but i'm also looking for some information on trains . is this something that you can help me with .",
      "start_ms": 83400,
      "end_ms": 90010
    },
    {
      "turn_id": "t18",
      "speaker": "agent",
      "text": "yes , i'll be happy to assist you with that as well .",
      "start_ms": 90090,
      "end_ms": 92890
    },
    {
      "turn_id": "t19",
      "speaker": "user",
      "text": "okay , so i'm looking for a train going from cambridge to laster .",
      "start_ms": 93070,
      "end_ms": 98860
    },
    {
      "turn_id": "t20",
      "speaker": "agent",
      "text": "okay , i can check out your job is and see what we have .",
      "start_ms": 99590,
      "end_ms": 102710
    },
    {
      "turn_id": "t21",
      "speaker": "user",
      "text": "okay , so i'm interested in a train that will be leaving cambridge on today's wednesday . so two days from now and should leave cambridge after 6 1745 .",
      "start_ms": 103210,
      "end_ms": 116360
    },
    {
      "turn_id": "t22",
      "speaker": "agent",
      "text": "okay , what i can offer you on friday . is . a train id tr4727 leaves cambridge at . 1821 would that work for you .",
      "start_ms": 116880,
      "end_ms": 129540
    },
    {
      "turn_id": "t23",
      "speaker": "user",
      "text": "yes , that works perfectly . could you please tell me what time the train arrives into lester .",
      "start_ms": 129820,
      "end_ms": 136360
    },
    {
      "turn_id": "t24",
      "speaker": "agent",
      "text": "yes , such as did the arrival time is 20:06 .",
      "start_ms": 136650,
      "end_ms": 141360
    },
    {
      "turn_id": "t25",
      "speaker": "user",
      "text": "all right , thank you so much for that information .",
      "start_ms": 142430,
      "end_ms": 145590
    },
    {
      "turn_id": "t26",
      "speaker": "agent",
      "text": "you are most welcome . is there anything else that i can assist you .",
      "start_ms": 146040,
      "end_ms": 149170
    },
    {
      "turn_id": "t27",
      "speaker": "user",
      "text": "that was all i needed help with today . thank you .",
      "start_ms": 149430,
      "end_ms": 152640
    },
    {
      "turn_id": "t28",
      "speaker": "agent",
      "text": "okay , thank you so much for calling .",
      "start_ms": 152530,
      "end_ms": 154950
    }
  ],
  "audio_path": null,
  "metadata": {
    "license": "CC BY-NC 4.0 (eval use)",
    "speaker_source": "tag field (channel ids do not separate speakers)",
    "skipped_unwordtimed_turns": 0,
    "n_plausible_overlaps": 1,
    "n_long_intra_pauses": 0,
    "goal": {
      "profile": {
        "info": {
          "name": "eric wilkerson"
        }
      },
      "restaurant": {
        "book": {
          "day": "thursday",
          "people": "4",
          "time": "13:15"
        },
        "info": {
          "name": "curry prince"
        }
      },
      "train": {
        "info": {
          "day": "friday",
          "departure": "cambridge",
          "destination": "leicester",
          "leaveAt": "17:45"
        },
        "reqt": [
          "arriveBy"
        ]
      }
    },
    "selection_bucket": "clean_quiet"
  },
  "outcome": {
    "call_id": "swz_MUL0280",
    "task_completed": false,
    "required_fields": [
      {
        "name": "profile.name",
        "captured": false,
        "value": null
      },
      {
        "name": "restaurant.name",
        "captured": true,
        "value": "curry prince"
      },
      {
        "name": "restaurant.book_day",
        "captured": true,
        "value": "thursday"
      },
      {
        "name": "restaurant.book_people",
        "captured": true,
        "value": "4"
      },
      {
        "name": "restaurant.book_time",
        "captured": false,
        "value": null
      },
      {
        "name": "train.day",
        "captured": true,
        "value": "friday"
      },
      {
        "name": "train.departure",
        "captured": true,
        "value": "cambridge"
      },
      {
        "name": "train.destination",
        "captured": false,
        "value": null
      },
      {
        "name": "train.leaveAt",
        "captured": false,
        "value": null
      },
      {
        "name": "train.arriveBy",
        "captured": false,
        "value": null
      }
    ],
    "escalation_needed": false,
    "confidence": 0.5
  },
  "scorecard": {
    "call_id": "swz_MUL0280",
    "dimensions": [
      {
        "name": "barge_in",
        "type": "deterministic",
        "score": 0.66,
        "reason": "agent interrupted the caller 1x (overlap 110ms)",
        "evidence_turn_ids": [
          "t27",
          "t28"
        ]
      },
      {
        "name": "latency_gap",
        "type": "deterministic",
        "score": 1.0,
        "reason": "median 435.0ms / p90 570ms; 0/12 responses laggy (>800ms)",
        "evidence_turn_ids": []
      },
      {
        "name": "task_completion",
        "type": "deterministic",
        "score": 0.5,
        "reason": "captured 5/10 required fields (heuristic from goal/workflow)",
        "evidence_turn_ids": []
      }
    ],
    "overall": 0.72
  },
  "cost": {
    "call_id": "swz_MUL0280",
    "duration_s": 154.9,
    "turn_count": 28,
    "est_llm_calls": 14,
    "est_cost_total": 0.07,
    "est_cost_per_success_note": "estimated, prototype"
  },
  "failures": [
    {
      "at_ms": 152530,
      "dimension": "barge_in",
      "label": "agent barge-in",
      "detail": "110ms overlap",
      "evidence_turn_ids": [
        "t27",
        "t28"
      ],
      "call_id": "swz_MUL0280",
      "origin": "deterministic"
    }
  ],
  "signals": {
    "latency": {
      "n_handoffs": 12,
      "median_gap_ms": 435.0,
      "p90_gap_ms": 570,
      "laggy_threshold_ms": 800,
      "n_laggy": 0
    },
    "n_barge_ins": 1
  }
}