{
  "call_id": "swz_MUL0069",
  "source": "spokenwoz",
  "language": "en",
  "stress_profile": "clean",
  "workflow_type": "attraction+hotel+profile",
  "turns": [
    {
      "turn_id": "t1",
      "speaker": "user",
      "text": "hello .",
      "start_ms": 1670,
      "end_ms": 3000
    },
    {
      "turn_id": "t2",
      "speaker": "agent",
      "text": "hi customer service center . how can i help you .",
      "start_ms": 3140,
      "end_ms": 6330
    },
    {
      "turn_id": "t3",
      "speaker": "user",
      "text": "hi , i am now traveling in cambridge and i'm looking for some information .  uh , there's a particular attraction called the man on the moon . can you help me find .",
      "start_ms": 6620,
      "end_ms": 18350
    },
    {
      "turn_id": "t4",
      "speaker": "agent",
      "text": "yes . um , the man on the moon . of course i found this for you . what kind of information do you need .",
      "start_ms": 19350,
      "end_ms": 26110
    },
    {
      "turn_id": "t5",
      "speaker": "user",
      "text": "i want to know the area and address .",
      "start_ms": 26440,
      "end_ms": 30180
    },
    {
      "turn_id": "t6",
      "speaker": "agent",
      "text": "okay . it's in the centre of the city and address is . to norfolk street. .",
      "start_ms": 30490,
      "end_ms": 39470
    },
    {
      "turn_id": "t7",
      "speaker": "user",
      "text": "okay , i see . thank you and here's another thing . i also looking for a place to stay overnight .  uh , please help me to find a four star hotel .  uh , it's better with free wi .",
      "start_ms": 40180,
      "end_ms": 53960
    },
    {
      "turn_id": "t8",
      "speaker": "agent",
      "text": "ok 4 star hotel with free wi fi . and do you need parking lot .",
      "start_ms": 55540,
      "end_ms": 62440
    },
    {
      "turn_id": "t9",
      "speaker": "user",
      "text": "well , let me think about it . i maybe drive my car , maybe not so .  it doesn't matter , i guess .",
      "start_ms": 63040,
      "end_ms": 70990
    },
    {
      "turn_id": "t10",
      "speaker": "agent",
      "text": "okay , then . hold on a second . yes , i don't . a hotel for you .",
      "start_ms": 71590,
      "end_ms": 81690
    },
    {
      "turn_id": "t11",
      "speaker": "user",
      "text": "okay .",
      "start_ms": 82110,
      "end_ms": 83200
    },
    {
      "turn_id": "t12",
      "speaker": "agent",
      "text": "and the name is huntingdon marriott hotel hotel .",
      "start_ms": 85200,
      "end_ms": 89290
    },
    {
      "turn_id": "t13",
      "speaker": "user",
      "text": "oh , sounds good .  um .  do they have parking .",
      "start_ms": 89830,
      "end_ms": 94650
    },
    {
      "turn_id": "t14",
      "speaker": "agent",
      "text": "yes , they have free parking lot .",
      "start_ms": 95370,
      "end_ms": 98020
    },
    {
      "turn_id": "t15",
      "speaker": "user",
      "text": "okay .  uh , then please help me to book a room for two people and five nights starting from tuesday .",
      "start_ms": 98090,
      "end_ms": 108000
    },
    {
      "turn_id": "t16",
      "speaker": "agent",
      "text": "okay , 2 for 5 . starting from tuesday . um before that , can i have your name .",
      "start_ms": 108930,
      "end_ms": 116740
    },
    {
      "turn_id": "t17",
      "speaker": "user",
      "text": "yes , my name is zhang anderson .",
      "start_ms": 117080,
      "end_ms": 120400
    },
    {
      "turn_id": "t18",
      "speaker": "agent",
      "text": "okay . how do you spell anderson .",
      "start_ms": 120640,
      "end_ms": 123090
    },
    {
      "turn_id": "t19",
      "speaker": "user",
      "text": "if a n d r s o n .",
      "start_ms": 123430,
      "end_ms": 126640
    },
    {
      "turn_id": "t20",
      "speaker": "agent",
      "text": "okay , got it anderson . i'm sorry to tell you that we can't . 5 . can you accept 2 .",
      "start_ms": 126970,
      "end_ms": 138070
    },
    {
      "turn_id": "t21",
      "speaker": "user",
      "text": "oh , that's too bad then . yes , please two nights .",
      "start_ms": 138470,
      "end_ms": 144330
    },
    {
      "turn_id": "t22",
      "speaker": "agent",
      "text": "okay , then . ya . your booking has been 2 made . would you mind receiving orders via email .",
      "start_ms": 145170,
      "end_ms": 155379
    },
    {
      "turn_id": "t23",
      "speaker": "user",
      "text": "well , i don't need thank you .",
      "start_ms": 155920,
      "end_ms": 157860
    },
    {
      "turn_id": "t24",
      "speaker": "agent",
      "text": "okay , then . is there anything i can help with you .",
      "start_ms": 158650,
      "end_ms": 162460
    },
    {
      "turn_id": "t25",
      "speaker": "user",
      "text": "now i'm all fat . thank you so much .",
      "start_ms": 162790,
      "end_ms": 165660
    },
    {
      "turn_id": "t26",
      "speaker": "agent",
      "text": "you're welcome .",
      "start_ms": 165940,
      "end_ms": 167350
    }
  ],
  "audio_path": null,
  "metadata": {
    "license": "CC BY-NC 4.0 (eval use)",
    "speaker_source": "tag field (channel ids do not separate speakers)",
    "skipped_unwordtimed_turns": 0,
    "n_plausible_overlaps": 0,
    "n_long_intra_pauses": 2,
    "goal": {
      "attraction": {
        "info": {
          "name": "the man on the moon"
        },
        "reqt": [
          "area",
          "address"
        ]
      },
      "hotel": {
        "book": {
          "day": "tuesday",
          "people": "2",
          "stay": "2"
        },
        "info": {
          "internet": "yes",
          "parking": "yes",
          "stars": "4",
          "type": "hotel"
        }
      },
      "profile": {
        "info": {
          "name": "john anderson"
        }
      }
    },
    "selection_bucket": "clean_laggy"
  },
  "outcome": {
    "call_id": "swz_MUL0069",
    "task_completed": true,
    "required_fields": [
      {
        "name": "attraction.name",
        "captured": true,
        "value": "the man on the moon"
      },
      {
        "name": "attraction.area",
        "captured": false,
        "value": null
      },
      {
        "name": "attraction.address",
        "captured": true,
        "value": null
      },
      {
        "name": "hotel.internet",
        "captured": true,
        "value": "yes"
      },
      {
        "name": "hotel.parking",
        "captured": true,
        "value": "yes"
      },
      {
        "name": "hotel.stars",
        "captured": true,
        "value": "4"
      },
      {
        "name": "hotel.type",
        "captured": true,
        "value": "hotel"
      },
      {
        "name": "hotel.book_day",
        "captured": true,
        "value": "tuesday"
      },
      {
        "name": "hotel.book_people",
        "captured": true,
        "value": "2"
      },
      {
        "name": "hotel.book_stay",
        "captured": true,
        "value": "2"
      },
      {
        "name": "profile.name",
        "captured": false,
        "value": null
      }
    ],
    "escalation_needed": false,
    "confidence": 0.82
  },
  "scorecard": {
    "call_id": "swz_MUL0069",
    "dimensions": [
      {
        "name": "barge_in",
        "type": "deterministic",
        "score": 1.0,
        "reason": "no agent barge-ins",
        "evidence_turn_ids": []
      },
      {
        "name": "latency_gap",
        "type": "deterministic",
        "score": 0.615,
        "reason": "median 720ms / p90 1580ms; 5/13 responses laggy (>800ms)",
        "evidence_turn_ids": [
          "t4",
          "t8",
          "t12",
          "t16",
          "t22"
        ]
      },
      {
        "name": "task_completion",
        "type": "deterministic",
        "score": 0.818,
        "reason": "captured 9/11 required fields (heuristic from goal/workflow)",
        "evidence_turn_ids": []
      }
    ],
    "overall": 0.811
  },
  "cost": {
    "call_id": "swz_MUL0069",
    "duration_s": 167.3,
    "turn_count": 26,
    "est_llm_calls": 13,
    "est_cost_total": 0.065,
    "est_cost_per_success_note": "estimated, prototype"
  },
  "failures": [
    {
      "at_ms": 19350,
      "dimension": "latency_gap",
      "label": "response latency",
      "detail": "1,000ms gap",
      "evidence_turn_ids": [
        "t3",
        "t4"
      ],
      "call_id": "swz_MUL0069",
      "origin": "deterministic"
    },
    {
      "at_ms": 55540,
      "dimension": "latency_gap",
      "label": "response latency",
      "detail": "1,580ms gap",
      "evidence_turn_ids": [
        "t7",
        "t8"
      ],
      "call_id": "swz_MUL0069",
      "origin": "deterministic"
    },
    {
      "at_ms": 85200,
      "dimension": "latency_gap",
      "label": "response latency",
      "detail": "2,000ms gap",
      "evidence_turn_ids": [
        "t11",
        "t12"
      ],
      "call_id": "swz_MUL0069",
      "origin": "deterministic"
    },
    {
      "at_ms": 108930,
      "dimension": "latency_gap",
      "label": "response latency",
      "detail": "930ms gap",
      "evidence_turn_ids": [
        "t15",
        "t16"
      ],
      "call_id": "swz_MUL0069",
      "origin": "deterministic"
    },
    {
      "at_ms": 145170,
      "dimension": "latency_gap",
      "label": "response latency",
      "detail": "840ms gap",
      "evidence_turn_ids": [
        "t21",
        "t22"
      ],
      "call_id": "swz_MUL0069",
      "origin": "deterministic"
    }
  ],
  "signals": {
    "latency": {
      "n_handoffs": 13,
      "median_gap_ms": 720,
      "p90_gap_ms": 1580,
      "laggy_threshold_ms": 800,
      "n_laggy": 5
    },
    "n_barge_ins": 0
  }
}