{
  "call_id": "swz_MUL0211",
  "source": "spokenwoz",
  "language": "en",
  "stress_profile": "interruption",
  "workflow_type": "hotel+profile+restaurant",
  "turns": [
    {
      "turn_id": "t1",
      "speaker": "user",
      "text": "hi , hello .",
      "start_ms": 880,
      "end_ms": 2330
    },
    {
      "turn_id": "t2",
      "speaker": "agent",
      "text": "hi , may i help you .",
      "start_ms": 2450,
      "end_ms": 4190
    },
    {
      "turn_id": "t3",
      "speaker": "user",
      "text": "yes , i'm actually looking for a place to stay . i want to stay in the hotel and it should be in a spin .  expensive price range . could you help me to check .",
      "start_ms": 4180,
      "end_ms": 16050
    },
    {
      "turn_id": "t4",
      "speaker": "agent",
      "text": "okay , let me take it for you . we do have several choices . would you like me to add more information so i could choice for you .",
      "start_ms": 16820,
      "end_ms": 26670
    },
    {
      "turn_id": "t5",
      "speaker": "user",
      "text": "um yeah , i will drive to here , so .  you may help me to find some places where it could be .  um park my car .",
      "start_ms": 26630,
      "end_ms": 38660
    },
    {
      "turn_id": "t6",
      "speaker": "agent",
      "text": "okay . let me check a free parking hotel for you . so we do have a hakka . do you like me to book room for you .",
      "start_ms": 39120,
      "end_ms": 51180
    },
    {
      "turn_id": "t7",
      "speaker": "user",
      "text": "yes , that would be awesome . there will be only me .  and then i would like to stay for two nights and start at wednesday .",
      "start_ms": 50870,
      "end_ms": 61090
    },
    {
      "turn_id": "t8",
      "speaker": "agent",
      "text": "okay , let me check . i'm afraid wednesday is not available . would you like . to try another day .",
      "start_ms": 61750,
      "end_ms": 70060
    },
    {
      "turn_id": "t9",
      "speaker": "user",
      "text": "um could you check whether friday is ok .",
      "start_ms": 70350,
      "end_ms": 74180
    },
    {
      "turn_id": "t10",
      "speaker": "agent",
      "text": "yes , friday is okay . your book is successful . now what else i can do for you .",
      "start_ms": 75150,
      "end_ms": 81650
    },
    {
      "turn_id": "t11",
      "speaker": "user",
      "text": "yes , i'm also looking for a particular restaurant . it's named the cooper cattle .",
      "start_ms": 81490,
      "end_ms": 87030
    },
    {
      "turn_id": "t12",
      "speaker": "agent",
      "text": "okay , the copper kettle is in the centre of the city .",
      "start_ms": 87800,
      "end_ms": 92409
    },
    {
      "turn_id": "t13",
      "speaker": "user",
      "text": "oh , that's in the center of the city . that's great .",
      "start_ms": 92320,
      "end_ms": 95850
    },
    {
      "turn_id": "t14",
      "speaker": "agent",
      "text": "okay . would you like . to receive our email orders .",
      "start_ms": 97190,
      "end_ms": 102190
    },
    {
      "turn_id": "t15",
      "speaker": "user",
      "text": "oh , you mean the hotel . yes , please send me the email .",
      "start_ms": 102410,
      "end_ms": 106520
    },
    {
      "turn_id": "t16",
      "speaker": "agent",
      "text": "okay , please tell me your email address .",
      "start_ms": 107310,
      "end_ms": 110440
    },
    {
      "turn_id": "t17",
      "speaker": "user",
      "text": "um the email address is a capital letter r p .  and then lower case a t r i c k .  w h i b f .  outlook dot com .",
      "start_ms": 110290,
      "end_ms": 123220
    },
    {
      "turn_id": "t18",
      "speaker": "agent",
      "text": "okay , your orders will be received in few seconds . and for your orders , may i receive your name , please .",
      "start_ms": 123810,
      "end_ms": 130760
    },
    {
      "turn_id": "t19",
      "speaker": "user",
      "text": "yes , it's rose , patrick .",
      "start_ms": 130330,
      "end_ms": 132640
    },
    {
      "turn_id": "t20",
      "speaker": "agent",
      "text": "okay . thanks . what else i can do for you .",
      "start_ms": 133300,
      "end_ms": 137130
    },
    {
      "turn_id": "t21",
      "speaker": "user",
      "text": "no , that should be all thank you .",
      "start_ms": 136920,
      "end_ms": 139310
    },
    {
      "turn_id": "t22",
      "speaker": "agent",
      "text": "thank you . you have nice day . bye .",
      "start_ms": 139620,
      "end_ms": 142180
    }
  ],
  "audio_path": null,
  "metadata": {
    "license": "CC BY-NC 4.0 (eval use)",
    "speaker_source": "tag field (channel ids do not separate speakers)",
    "skipped_unwordtimed_turns": 0,
    "n_plausible_overlaps": 5,
    "n_long_intra_pauses": 0,
    "goal": {
      "hotel": {
        "book": {
          "day": "friday"
        },
        "info": {
          "parking": "yes",
          "pricerange": "expensive",
          "type": "hotel"
        }
      },
      "profile": {
        "info": {
          "email": "rpatrickwhib@outlook.com",
          "name": "ross patrick"
        }
      },
      "restaurant": {
        "info": {
          "name": "the copper kettle"
        },
        "reqt": [
          "area"
        ]
      }
    },
    "selection_bucket": "interruption"
  },
  "outcome": {
    "call_id": "swz_MUL0211",
    "task_completed": false,
    "required_fields": [
      {
        "name": "hotel.parking",
        "captured": true,
        "value": "yes"
      },
      {
        "name": "hotel.pricerange",
        "captured": true,
        "value": "expensive"
      },
      {
        "name": "hotel.type",
        "captured": true,
        "value": "hotel"
      },
      {
        "name": "hotel.book_day",
        "captured": true,
        "value": "friday"
      },
      {
        "name": "profile.email",
        "captured": false,
        "value": null
      },
      {
        "name": "profile.name",
        "captured": false,
        "value": null
      },
      {
        "name": "restaurant.name",
        "captured": true,
        "value": "the copper kettle"
      },
      {
        "name": "restaurant.area",
        "captured": false,
        "value": null
      }
    ],
    "escalation_needed": false,
    "confidence": 0.62
  },
  "scorecard": {
    "call_id": "swz_MUL0211",
    "dimensions": [
      {
        "name": "barge_in",
        "type": "deterministic",
        "score": 1.0,
        "reason": "no agent barge-ins",
        "evidence_turn_ids": []
      },
      {
        "name": "latency_gap",
        "type": "deterministic",
        "score": 0.818,
        "reason": "median 660ms / p90 970ms; 2/11 responses laggy (>800ms)",
        "evidence_turn_ids": [
          "t10",
          "t14"
        ]
      },
      {
        "name": "task_completion",
        "type": "deterministic",
        "score": 0.625,
        "reason": "captured 5/8 required fields (heuristic from goal/workflow)",
        "evidence_turn_ids": []
      }
    ],
    "overall": 0.814
  },
  "cost": {
    "call_id": "swz_MUL0211",
    "duration_s": 142.2,
    "turn_count": 22,
    "est_llm_calls": 11,
    "est_cost_total": 0.055,
    "est_cost_per_success_note": "estimated, prototype"
  },
  "failures": [
    {
      "at_ms": 50870,
      "dimension": "barge_in",
      "label": "user barge-in",
      "detail": "310ms overlap",
      "evidence_turn_ids": [
        "t6",
        "t7"
      ],
      "call_id": "swz_MUL0211",
      "origin": "deterministic"
    },
    {
      "at_ms": 75150,
      "dimension": "latency_gap",
      "label": "response latency",
      "detail": "970ms gap",
      "evidence_turn_ids": [
        "t9",
        "t10"
      ],
      "call_id": "swz_MUL0211",
      "origin": "deterministic"
    },
    {
      "at_ms": 81490,
      "dimension": "barge_in",
      "label": "user barge-in",
      "detail": "160ms overlap",
      "evidence_turn_ids": [
        "t10",
        "t11"
      ],
      "call_id": "swz_MUL0211",
      "origin": "deterministic"
    },
    {
      "at_ms": 97190,
      "dimension": "latency_gap",
      "label": "response latency",
      "detail": "1,340ms gap",
      "evidence_turn_ids": [
        "t13",
        "t14"
      ],
      "call_id": "swz_MUL0211",
      "origin": "deterministic"
    },
    {
      "at_ms": 110290,
      "dimension": "barge_in",
      "label": "user barge-in",
      "detail": "150ms overlap",
      "evidence_turn_ids": [
        "t16",
        "t17"
      ],
      "call_id": "swz_MUL0211",
      "origin": "deterministic"
    },
    {
      "at_ms": 130330,
      "dimension": "barge_in",
      "label": "user barge-in",
      "detail": "430ms overlap",
      "evidence_turn_ids": [
        "t18",
        "t19"
      ],
      "call_id": "swz_MUL0211",
      "origin": "deterministic"
    },
    {
      "at_ms": 136920,
      "dimension": "barge_in",
      "label": "user barge-in",
      "detail": "210ms overlap",
      "evidence_turn_ids": [
        "t20",
        "t21"
      ],
      "call_id": "swz_MUL0211",
      "origin": "deterministic"
    }
  ],
  "signals": {
    "latency": {
      "n_handoffs": 11,
      "median_gap_ms": 660,
      "p90_gap_ms": 970,
      "laggy_threshold_ms": 800,
      "n_laggy": 2
    },
    "n_barge_ins": 5
  }
}